{
  "id": "urp",
  "name": "URP 教务",
  "version": "1.0.0",
  "aliases": [
    "urp",
    "URP 教务"
  ],
  "detect": {
    "markers": [
      "urp",
      "教学信息服务平台",
      "jwgl\\.urp"
    ],
    "timetableTableIds": [],
    "timetableTableClasses": [],
    "gridCellIdPatterns": []
  },
  "login": {
    "entryPath": "/",
    "hint": "综合教务系统，课表在「课表查询」"
  }
}
